{
  "schema_version": "0.1",
  "module_format": "commonjs",
  "entry": "main.js",
  "files": [
    {
      "path": "main.js",
      "exports": [],
      "imports": [
        "src/engine.js"
      ]
    },
    {
      "path": "src/engine.js",
      "exports": [
        "runSimulation"
      ],
      "imports": [
        "src/metabolism.js",
        "src/behavior.js"
      ]
    },
    {
      "path": "src/metabolism.js",
      "exports": [
        "applyHunger",
        "applyDeath"
      ],
      "imports": []
    },
    {
      "path": "src/behavior.js",
      "exports": [
        "applyMovement",
        "applyPredation",
        "applyReproduction"
      ],
      "imports": []
    }
  ]
}