{
  "schema_version": "0.1",
  "module_format": "commonjs",
  "entry": "main.js",
  "files": [
    { "path": "main.js", "exports": [], "imports": ["src/engine.js", "src/scenarios.js"] },
    { "path": "src/engine.js", "exports": ["runScenario"], "imports": ["src/game_logic.js"] },
    { "path": "src/game_logic.js", "exports": ["applyAction", "checkGameState", "updateState"], "imports": [] },
    { "path": "src/scenarios.js", "exports": ["getScenario"], "imports": [] }
  ]
}
