{
  "schema_version": "0.1",
  "module_format": "commonjs",
  "entry": "main.js",
  "files": [
    {"path": "main.js", "exports": [], "imports": ["src/engine.js", "src/format.js"]},
    {"path": "src/engine.js", "exports": ["runScenario"], "imports": ["src/constants.js", "src/levels.js", "src/state.js", "src/move_logic.js"]},
    {"path": "src/move_logic.js", "exports": ["resolveMove", "boxIndexAt"], "imports": ["src/constants.js"]},
    {"path": "src/levels.js", "exports": ["LEVELS"], "imports": []},
    {"path": "src/state.js", "exports": ["createInitialState"], "imports": []},
    {"path": "src/format.js", "exports": ["render"], "imports": []},
    {"path": "src/constants.js", "exports": ["DIRS", "MAX_MOVES"], "imports": []}
  ]
}
