{
  "schema_version": "0.1",
  "module_format": "commonjs",
  "entry": "main.js",
  "files": [
    {
      "path": "main.js",
      "exports": [],
      "imports": [
        "src/engine.js"
      ]
    },
    {
      "path": "src/engine.js",
      "exports": [
        "runScenario"
      ],
      "imports": [
        "src/logic.js"
      ]
    },
    {
      "path": "src/logic.js",
      "exports": [
        "applyWait",
        "applyAdvance",
        "createInitialState"
      ],
      "imports": [
        "src/constants.js"
      ]
    },
    {
      "path": "src/constants.js",
      "exports": [
        "constants"
      ],
      "imports": []
    }
  ]
}