{
  "schema_version": "0.1",
  "module_format": "commonjs",
  "entry": "main.js",
  "files": [
    {"path": "main.js", "exports": [], "imports": ["src/engine.js", "src/format.js"]},
    {"path": "src/engine.js", "exports": ["runScenario"], "imports": ["src/constants.js", "src/state.js", "src/unit_logic.js"]},
    {"path": "src/unit_logic.js", "exports": ["applyPoison", "gainGauge", "decStun", "calculateAction"], "imports": ["src/constants.js"]},
    {"path": "src/state.js", "exports": ["createInitialState"], "imports": []},
    {"path": "src/format.js", "exports": ["render"], "imports": []},
    {"path": "src/constants.js", "exports": [], "imports": []}
  ]
}
